wav_filename,wav_filesize,transcript
/home/jia/project/backend/audios/test/1249120_39154234_30443036.wav,158424,when i stand up too quickly i feel as though i'm going to faint 
/home/jia/project/backend/audios/test/1249120_42554554_86304872.wav,109272,when i wake up in the morning i feel dizzy
/home/jia/project/backend/audios/test/1249120_41087148_80182057.wav,155692,i can't walk well i have an ache in my foot
/home/jia/project/backend/audios/test/1249120_43951421_59477595.wav,213036,i get breakouts on my chest with red patches that get more intense when i get hot 
/home/jia/project/backend/audios/test/1249120_42557795_49921159.wav,259458,i cut my finger opening a can  it won't stop bleeding and the wound is gaping and open
/home/jia/project/backend/audios/test/1249120_36214391_78596944.wav,106540,my head ache since i woke up this morning 
/home/jia/project/backend/audios/test/1249120_44093303_75327647.wav,104070,i have a sharp pain in my neck
/home/jia/project/backend/audios/test/1249120_41841195_87664618.wav,213036,i wake up with a stiff neck every morning   massage helps but then a couple of days later it's back again 
/home/jia/project/backend/audios/test/1249120_15830408_20700304.wav,136578,when i bend over i get a shooting pain down my back
/home/jia/project/backend/audios/test/1249120_42210938_89218644.wav,95618,my cut yellow or greenish colored pus
/home/jia/project/backend/audios/test/1249120_6338946_86910481.wav,191192,every time i look to left i feel a sharp pain in my neck 
/home/jia/project/backend/audios/test/1249120_33905644_98655344.wav,128386,i think there's fluid in my ears 
/home/jia/project/backend/audios/test/1249120_21665495_37002363.wav,185730,i noticed an important decrease in my vision when i try to look at things up close 
/home/jia/project/backend/audios/test/1249120_43788827_104701642.wav,121904,there is a sharp pain in my bicep
/home/jia/project/backend/audios/test/1249120_43612961_73964634.wav,107042,i have a lot of mucus when i cough 
/home/jia/project/backend/audios/test/1249120_18386513_17142584.wav,92182,i complain alot with skin allergy
/home/jia/project/backend/audios/test/1249120_43402738_96067572.wav,101080,there are lots of hairs on my pillow in the morning 
/home/jia/project/backend/audios/test/1249120_40571337_46024686.wav,150232,i feel a soreness in my knees when i walk
/home/jia/project/backend/audios/test/1249120_40184183_60266732.wav,191192,even though i'm an adult my face keeps breaking out in pimples 
/home/jia/project/backend/audios/test/1249120_43788827_84947073.wav,205124,i feel strong pain in my knee after it was hit during the football match 
/home/jia/project/backend/audios/test/1249120_43855932_105242356.wav,147500,my knee catches and hurts when i first stand up after sitting 
/home/jia/project/backend/audios/test/1249120_43883861_29427209.wav,281304,i have pimples in patches along with a lot of redness on my face 
/home/jia/project/backend/audios/test/1249120_43350908_78514889.wav,92888,need to scratch my skin every minute
/home/jia/project/backend/audios/test/1249120_41150153_77373233.wav,101080,my acne is really embarassing  it's so read 
/home/jia/project/backend/audios/test/1249120_28006404_70616833.wav,86238,i have muscle pain at my left leg 
/home/jia/project/backend/audios/test/1249120_38042052_104320582.wav,120194,i have terrible pain in my heart
/home/jia/project/backend/audios/test/1249120_20518958_68106807.wav,221228,i broke my ankle while doing rock climbing in the carpathians 
/home/jia/project/backend/audios/test/1249120_42210938_96860829.wav,73772,i think my wound is infected
/home/jia/project/backend/audios/test/1249120_41221824_103662774.wav,166616,i cough a lot when i smell perfume  what is wrong with my lungs 
/home/jia/project/backend/audios/test/1249120_18172663_51105105.wav,92888,i feel like the room is spinning
/home/jia/project/backend/audios/test/1249120_40419625_45835464.wav,347788,i started taking swimming lessons and i guess i swallowed too much water through my nose  because this sinusitis is killing me now 
/home/jia/project/backend/audios/test/1249120_43918153_54922769.wav,109272,my neck feels stiff
/home/jia/project/backend/audios/test/1249120_30937687_93187032.wav,190262,when i stand i feel dizzy i do not know why
/home/jia/project/backend/audios/test/1249120_43698316_43698203.wav,114732,in the morning my respiration is loud 
/home/jia/project/backend/audios/test/1249120_28006404_94559591.wav,112986,when i played football i dislocated my shoulder
/home/jia/project/backend/audios/test/1249120_43577102_29848441.wav,231874,i cut my finger opening a can  it won't stop bleeding and the wound is gaping and open
/home/jia/project/backend/audios/test/1249120_1853182_83347773.wav,112986,i cant sleep because of cough
/home/jia/project/backend/audios/test/1249120_44111844_85643856.wav,112002,when i walk up a flight of stairs  my right knee hurts 
/home/jia/project/backend/audios/test/1249120_43105396_90526094.wav,95618,when i carry heavy things i feel like breaking my back
/home/jia/project/backend/audios/test/1249120_30937687_43377541.wav,157570,sometimes my body feels week without reason
/home/jia/project/backend/audios/test/1249120_38202325_57751307.wav,101080,my left side aches much
/home/jia/project/backend/audios/test/1249120_43825820_86733021.wav,181634,i carried a heavy bag yesterday and when i get up today i felt a great shoulder pain 
/home/jia/project/backend/audios/test/1249120_43604449_22992110.wav,84696,my wound opened up again
/home/jia/project/backend/audios/test/1249120_40725179_96189973.wav,104070,i have difficulty moving my neck
/home/jia/project/backend/audios/test/1249120_40571337_100108399.wav,161154,i felt my heart hurts when i ran for along distance
/home/jia/project/backend/audios/test/1249120_6338946_49886993.wav,90156,my left side aches much
/home/jia/project/backend/audios/test/1249120_18386513_54530444.wav,148652,my back hurts so much i can't bend down to tie my shoelaces 
/home/jia/project/backend/audios/test/1249120_43918153_93094874.wav,196652,i walk every day but now i get short of breath after going only a short way 
/home/jia/project/backend/audios/test/1249120_35444693_109723262.wav,125656,i have a hard pain in my stomach
/home/jia/project/backend/audios/test/1249120_43855932_61136931.wav,114732,i feel cold and chills even though my clothes are heavy
/home/jia/project/backend/audios/test/1249120_41336418_27204447.wav,202114,my son nicked his neck with an old razor and that spot has become inflamed and looks like it is infected 
/home/jia/project/backend/audios/test/1249120_39154234_22019787.wav,169346,my acne is really embarassing  it's so read 
/home/jia/project/backend/audios/test/1249120_1853182_41518759.wav,139736,my kneecap feels like it is grating bone on bone when i walk 
/home/jia/project/backend/audios/test/1249120_39740177_23575663.wav,161154,chronic disease of hair follicles and sebaceous glands 
/home/jia/project/backend/audios/test/1249120_42210938_68900643.wav,106540,i have general discomfort in my torso 
/home/jia/project/backend/audios/test/1249120_21665495_17611668.wav,297688,i fell through a window while i was cleaning it and i have a shard of glass stuck in my left eye  i think it is pretty serious  please help 
/home/jia/project/backend/audios/test/1249120_33251186_66008404.wav,251266,severe pain in the upper left side of chest and may have pain to back
/home/jia/project/backend/audios/test/1249120_18172663_93142539.wav,125656,i feel a pain on the left side of my chest  where my heart is
/home/jia/project/backend/audios/test/1249120_30937687_82234721.wav,193236,when i stand up too quickly i start to feel dizzy and light headed
/home/jia/project/backend/audios/test/1249120_14353703_41394319.wav,68312,i'm disappointed
/home/jia/project/backend/audios/test/1249120_28006404_32507439.wav,127848,the warming system of my house is broken and  feel so cold
/home/jia/project/backend/audios/test/1249120_41203338_79174522.wav,104070,i have an open wound in my arm
/home/jia/project/backend/audios/test/1249120_41221824_38407271.wav,79234,my shoulder hurts me so much
/home/jia/project/backend/audios/test/1249120_39154234_104799632.wav,150232,it feels like my heart is going to leap out of my body  it hurts 
/home/jia/project/backend/audios/test/1249120_22345789_43309990.wav,127848,i have terrible pain in my heart
/home/jia/project/backend/audios/test/1249120_18386513_100514958.wav,175402,i have pimples in patches along with a lot of redness on my face 
/home/jia/project/backend/audios/test/1249120_15830408_74933291.wav,90156,i feel very hard to breathe
/home/jia/project/backend/audios/test/1249120_18386513_10796746.wav,139736,when i was young i had an injury from sports in my knee 
/home/jia/project/backend/audios/test/1249120_41956733_27195023.wav,275842,my shoulder hurts when i try to reach something above my head 
/home/jia/project/backend/audios/test/1249120_43316708_50550172.wav,139308,i feel cold when the night comes
/home/jia/project/backend/audios/test/1249120_41221824_62743748.wav,120194,i have a feeling like my whole body is complaining
/home/jia/project/backend/audios/test/1249120_35408915_100067926.wav,81964,i feel suicidal 
/home/jia/project/backend/audios/test/1249120_29289135_90436401.wav,106540,i feel increased heart rate with prick
/home/jia/project/backend/audios/test/1249120_43918153_101085281.wav,177538,i feel a sharp pain in my ankle joint when i stand 
/home/jia/project/backend/audios/test/1249120_43788827_74476709.wav,89210,my shoulder is hurting me
/home/jia/project/backend/audios/test/1249120_44111844_75292978.wav,122924,after a breakup  i feel something strange in me 
/home/jia/project/backend/audios/test/1249120_43612961_88147084.wav,107042,i've been feeling very sad lately
/home/jia/project/backend/audios/test/1249120_43883861_105187263.wav,169346,i feel a sharp pain in my ankle joint when i stand 
/home/jia/project/backend/audios/test/1249120_43172391_25236833.wav,169346,i cannot bear this squeezing sensation i have in my chest 
/home/jia/project/backend/audios/test/1249120_30937687_80046081.wav,163514,i hit the ground when trying to shoot a basketball
/home/jia/project/backend/audios/test/1249120_40184183_81879872.wav,215768,my sore isn't healing well and it's been like this for two weeks 
/home/jia/project/backend/audios/test/1249120_41841195_80324388.wav,103810,i feel pain in my shoulders when i write on the keyboard 
/home/jia/project/backend/audios/test/1249120_33251186_10860276.wav,253996,had i stepped on a needle it wouldn't have hurt so much  like this damned spur in my heel 
/home/jia/project/backend/audios/test/1249120_43855932_104821230.wav,87426,i feel cold when the night comes
/home/jia/project/backend/audios/test/1249120_43316708_106265340.wav,122924,my back hurts a lot when i bend
/home/jia/project/backend/audios/test/1249120_43665783_20470197.wav,188460,there is pain in my joints  i can not bear pain
/home/jia/project/backend/audios/test/1249120_20518958_75755599.wav,148652,when i walk it's hard to breath 
/home/jia/project/backend/audios/test/1249120_43665783_15543541.wav,155692,when i eat sugar i notice my vision blurs 
/home/jia/project/backend/audios/test/1249120_13842059_12420758.wav,112002,i feel a sharp pain in my ankle joint when i stand 
/home/jia/project/backend/audios/test/1249120_44093303_28714152.wav,133792,i feel increased heart rate with prick
/home/jia/project/backend/audios/test/1249120_44140394_74818505.wav,95154,my knee hurts when i walk
/home/jia/project/backend/audios/test/1249120_35408915_65493600.wav,202114,i got a divorce last year and i just can't stop dwelling on how to get revenge on my ex husband 
/home/jia/project/backend/audios/test/1249120_6338946_43979955.wav,117464,the severe pain in the stomach i feel
/home/jia/project/backend/audios/test/1249120_43612961_85378406.wav,121904,i have a skin rash after eating an ice cream 
/home/jia/project/backend/audios/test/1249120_35444693_32125047.wav,180268,my body feels like it's in a refrigerator 
/home/jia/project/backend/audios/test/1249120_43788827_71887209.wav,133792,the wound is still open
/home/jia/project/backend/audios/test/1249120_41221824_66224590.wav,128386,i get clusters of whiteheads and blackheads on my back 
/home/jia/project/backend/audios/test/1249120_43316708_26840666.wav,125656,when i wake up in the morning i feel dizzy
/home/jia/project/backend/audios/test/1249120_35832653_35215279.wav,125656,my biceps started aching after i went to the gym
/home/jia/project/backend/audios/test/1249120_43918153_51392205.wav,117464,my skin is itching 
/home/jia/project/backend/audios/test/1249120_43350908_104896063.wav,131116,all my body is in a bad case and i need a good treatment
/home/jia/project/backend/audios/test/1249120_15965551_57015604.wav,102444,i got acne when i ate chili
/home/jia/project/backend/audios/test/1249120_41221824_25970038.wav,109272,there is pain in the muscles i do not know caused
/home/jia/project/backend/audios/test/1249120_43918153_25031936.wav,161154,my knees ache on cold and rainy days 
/home/jia/project/backend/audios/test/1249120_43918153_88914266.wav,147500,i feel pain in my back
/home/jia/project/backend/audios/test/1249120_39154234_12968336.wav,112002,my skin is very dry and peeling 
/home/jia/project/backend/audios/test/1249120_22423108_99422083.wav,155692,it's hard to stand up  and i'm moving very slowly
/home/jia/project/backend/audios/test/1249120_29713479_103218336.wav,154598,my hair always falls out and i have lost a lot of hair lately
/home/jia/project/backend/audios/test/1249120_6338946_33732438.wav,226690,i get breakouts on my chest with red patches that get more intense when i get hot 
/home/jia/project/backend/audios/test/1249120_43918153_29926230.wav,180268,i can't sleep i have a hard cough
/home/jia/project/backend/audios/test/1249120_19425875_74204923.wav,196652,i often get a sharp pain in my chest and i can't tell what i'm doing that might be triggering it 
/home/jia/project/backend/audios/test/1249120_41150153_28691888.wav,62850,i think there's fluid in my ears 
/home/jia/project/backend/audios/test/1249120_43788827_100955425.wav,151624,i toppled over while jumping to catch the ball 
/home/jia/project/backend/audios/test/1249120_19425875_20297828.wav,76504,i feel weak all over 
/home/jia/project/backend/audios/test/1249120_35408915_64227109.wav,101080,i have tried to relief it but i can't
/home/jia/project/backend/audios/test/1249120_43995026_46513971.wav,109272,my knees seem to grind as i go up or down stairs 
/home/jia/project/backend/audios/test/1249120_18172663_76673453.wav,106540,i have blurry vision after i used a wrong medicine 
/home/jia/project/backend/audios/test/1249120_41221824_50825515.wav,142040,when i tried to be warm and wear more clothes i found that i was still cold
/home/jia/project/backend/audios/test/1249120_35832653_76157240.wav,150232,my knees hurt so bad to walk that i stay sitting more than i should 
/home/jia/project/backend/audios/test/1249120_19425875_53324279.wav,133848,redness  swelling  and difficulty walking
/home/jia/project/backend/audios/test/1249120_40419625_32885636.wav,121904,i do not know why i feel cold
/home/jia/project/backend/audios/test/1249120_43758322_45008121.wav,221228,when i was young i had an injury from sports in my knee 
/home/jia/project/backend/audios/test/1249120_43856216_93777581.wav,133848,i feel really sad all the time 
/home/jia/project/backend/audios/test/1249120_44088493_39307149.wav,87426,there is a red stain in my skin
/home/jia/project/backend/audios/test/1249120_27392644_44306106.wav,78552,need to scratch my skin every minute
/home/jia/project/backend/audios/test/1249120_30937687_27530206.wav,142708,my body feels like it's in a refrigerator 
/home/jia/project/backend/audios/test/1249120_35832653_29860391.wav,177538,annoyance starts suddenly  often after an injury or exercise 
/home/jia/project/backend/audios/test/1249120_44101988_66662394.wav,95618,it's hard to see things
/home/jia/project/backend/audios/test/1249120_13842059_55474114.wav,106540,i feel pain in my foot
/home/jia/project/backend/audios/test/1249120_43995026_50739387.wav,112002,when i stand up too quickly i feel as though i'm going to faint 
/home/jia/project/backend/audios/test/1249120_43995026_44931478.wav,183000,my ear hurts and it's worse when i swallow   my ear is very painful and tylenol hasn't helped 
/home/jia/project/backend/audios/test/1249120_38202325_107785735.wav,112002,i'm injured i can't play sports
/home/jia/project/backend/audios/test/1249120_36929821_45934556.wav,87426,i feel pain in my body
/home/jia/project/backend/audios/test/1249120_35832653_46105544.wav,125656,i break out on my face very frequently
/home/jia/project/backend/audios/test/1249120_39154234_64570055.wav,136578,my hair is coming out in chunks  especially when i wash it
/home/jia/project/backend/audios/test/1249120_41087148_97162751.wav,142040,i feel pain in the knee when walking
/home/jia/project/backend/audios/test/1249120_43825820_86209370.wav,81964,surgical wound infections
/home/jia/project/backend/audios/test/1249120_35448024_21622145.wav,68404,i feel pain in the knee
/home/jia/project/backend/audios/test/1249120_33251186_93867567.wav,180268,when i extend my leg there is pain in knee joint
/home/jia/project/backend/audios/test/1249120_36929821_69275917.wav,166616,sometimes i feel like a claw on my chest that leaves me breathless 
/home/jia/project/backend/audios/test/1249120_44093303_57046343.wav,115960,his infected wound was beginning to rot 
/home/jia/project/backend/audios/test/1249120_22345789_10929211.wav,240790,i love to garden but i get a terrible twinge in my lower back when i lean over 
/home/jia/project/backend/audios/test/1249120_21665495_11109508.wav,172076,when i tried to take care if my hair i found that it is falling out
/home/jia/project/backend/audios/test/1249120_35154350_87119745.wav,185730,i fell a stiffness in my elbows and shoulders
/home/jia/project/backend/audios/test/1249120_44111844_82259967.wav,87426,is my cut infected or just healing 
/home/jia/project/backend/audios/test/1249120_1853182_43475712.wav,98126,i do not feel better in my muscles
/home/jia/project/backend/audios/test/1249120_35154350_52523216.wav,144770,my shower drain is full of hair every time 
/home/jia/project/backend/audios/test/1249120_43577102_89441804.wav,107042,my joints ache whenever it is cold
/home/jia/project/backend/audios/test/1249120_43898158_57187839.wav,122924,my body feels weak although i take my vitamins regularly 
/home/jia/project/backend/audios/test/1249120_42557795_49584450.wav,147500,when i'm doing sport i have pain under my skin
/home/jia/project/backend/audios/test/1249120_13842059_42977059.wav,223960,i feel like i went to an acupuncture's practice and had     needles in my shoulder
/home/jia/project/backend/audios/test/1249120_1853182_28883766.wav,136764,i got a divorce last year and i just can't stop dwelling on how to get revenge on my ex husband 
/home/jia/project/backend/audios/test/1249120_30766630_70207633.wav,136764,i have a blurry vision after my head was hit yesterday 
/home/jia/project/backend/audios/test/1249120_38202325_70574927.wav,92888,when i eat i feel my stomach hurts
/home/jia/project/backend/audios/test/1249120_27392644_15083037.wav,57388,i have a sharp pain in my ear
/home/jia/project/backend/audios/test/1249120_39740177_38724108.wav,131116,there is pain in the muscles i do not know caused
/home/jia/project/backend/audios/test/1249120_43995026_24386314.wav,51928,my ear is ringing 
/home/jia/project/backend/audios/test/1249120_43577102_82416595.wav,217012,surgical wounds red  firing pus  painful and hot to the touch
/home/jia/project/backend/audios/test/1249120_43719934_50536674.wav,172076,i have this strange rash on my arm 
/home/jia/project/backend/audios/test/1249120_29289135_41248036.wav,262188,there is an extreme pressure below my belly button at the right  which i feel every time i go out for a jog 
/home/jia/project/backend/audios/test/1249120_35408915_14980096.wav,109272,i can't move my leg  there is pain in the joint
/home/jia/project/backend/audios/test/1249120_43856216_13161998.wav,81964,my ear is ringing 
/home/jia/project/backend/audios/test/1249120_43951421_108895312.wav,90156,my skin is itching 
/home/jia/project/backend/audios/test/1249120_30937687_78575196.wav,151624,the feeling of coughing increases in winter's reach
/home/jia/project/backend/audios/test/1249120_38202325_34788421.wav,158424,the knee feels like it rusted and i suddenly cannot bend it anymore 
/home/jia/project/backend/audios/test/1249120_43995026_33790463.wav,76504,sharp pain and heavy breathing
/home/jia/project/backend/audios/test/1249120_43105396_52650663.wav,90156,i'm not feeling good i can't take my breath
/home/jia/project/backend/audios/test/1249120_35154350_89439845.wav,144770,i feel discomfort throughout the body in general
/home/jia/project/backend/audios/test/1249120_36929821_58017686.wav,106540,my hair is falling when i am combing it 
/home/jia/project/backend/audios/test/1249120_1853182_12144833.wav,101098,i feel depressed when i see my hair falling out
/home/jia/project/backend/audios/test/1249120_22345789_75547005.wav,175402,i have eruptions on my face that come and go  
/home/jia/project/backend/audios/test/1249120_30766630_14449136.wav,95154,my shoulder hurts me so much
/home/jia/project/backend/audios/test/1249120_39740177_42110171.wav,142040,i don't have the energy to do the things that i used to
/home/jia/project/backend/audios/test/1249120_22423108_15793389.wav,253996,i feel dizzy when i set in front of my laptop for an hour or two  what possibly could be the reason 
/home/jia/project/backend/audios/test/1249120_44140394_97177157.wav,121904,there are some pimples on my face that bother me a lot
/home/jia/project/backend/audios/test/1249120_19425875_91269142.wav,172076,the warming system of my house is broken and  feel so cold
/home/jia/project/backend/audios/test/1249120_41150153_58083690.wav,150232,i have some terrible problems when i'm breathing during the night 
/home/jia/project/backend/audios/test/1249120_43883861_70946243.wav,136578,when i go to stand  my head starts swirling
/home/jia/project/backend/audios/test/1249120_17632529_98635389.wav,124876,i'm not feeling good i can't take my breath
/home/jia/project/backend/audios/test/1249120_1853182_75011889.wav,104070,my back got injured while i was lifting at the gym
/home/jia/project/backend/audios/test/1249120_18386513_29050397.wav,77322,there pain in my foot
/home/jia/project/backend/audios/test/1249120_21665495_26803481.wav,202114,i just can't seem to get warm   even when everyone around me is warm i always feel cold 
/home/jia/project/backend/audios/test/1249120_42783052_31365843.wav,131116,i feel pain in my foot
/home/jia/project/backend/audios/test/1249120_39142299_69327378.wav,178374,there's swelling in my neck and it hurts 
/home/jia/project/backend/audios/test/1249120_41150153_41850383.wav,76504,my knee doesn't want to bend well 
/home/jia/project/backend/audios/test/1249120_20518958_50636369.wav,118932,my joints ache whenever it is cold
/home/jia/project/backend/audios/test/1249120_33251186_38544667.wav,210306,i cannot breathe because of this dull ache below my left shoulder 
/home/jia/project/backend/audios/test/1249120_43719934_38272043.wav,112002,i hate my acne 
/home/jia/project/backend/audios/test/1249120_43620482_79444288.wav,142040,i feel depressed when i see my hair falling out
/home/jia/project/backend/audios/test/1249120_43604449_43843054.wav,267650,my son got a tattoo several weeks ago and the skin around it is raised and hot and it looks infected 
/home/jia/project/backend/audios/test/1249120_6338946_66648466.wav,139308,i feel a sharp pain in my head when i think too hard 
/home/jia/project/backend/audios/test/1249120_40401830_76951996.wav,158424,i feel a burning sensation in my guts about   hours after each meal 
/home/jia/project/backend/audios/test/1249120_22345789_45339660.wav,151624,i get a knee pain when i walk a lot
/home/jia/project/backend/audios/test/1249120_30766630_30649963.wav,163514,i couldn't stop shaking or unclench my jaw  that's how cold i was 
/home/jia/project/backend/audios/test/1249120_43883861_96282257.wav,229420,i had a collision while playing soccer   my knee buckled and now it's unstable 
/home/jia/project/backend/audios/test/1249120_13842059_36985247.wav,73772,i feel dizzy and out of sight
/home/jia/project/backend/audios/test/1249120_15004831_33938813.wav,161154,i was playing football and injuried with joint pain 
/home/jia/project/backend/audios/test/1249120_41221824_37385657.wav,169346,the last time i clipped my toenails  i cut them too short and now i have an infected nail 
/home/jia/project/backend/audios/test/1249120_39438102_28198473.wav,174808,there is this pain that radiates from my chest up to my left arm 
/home/jia/project/backend/audios/test/1249120_42210938_89856373.wav,98348,i can't move my shoulder because of pain
/home/jia/project/backend/audios/test/1249120_43402738_109736151.wav,210306,i can't hear out of my ear properly  i feel like there is something in it causing irritation 
/home/jia/project/backend/audios/test/1249120_1853182_94150189.wav,148652,my wound was infected when i was planting some flowers in my garden
/home/jia/project/backend/audios/test/1249120_43698316_101462703.wav,128386,i have pain in my chest that saddens me 
/home/jia/project/backend/audios/test/1249120_43612961_21374408.wav,98126,stomach pain after drinking milk
/home/jia/project/backend/audios/test/1249120_43316708_47379867.wav,128386,my chest hurts when i go to take a breath
/home/jia/project/backend/audios/test/1249120_41087148_22778780.wav,120194,i feel cold when the night comes
/home/jia/project/backend/audios/test/1249120_15965551_50224784.wav,94252,my entire body is freezing 
