wav_filename,wav_filesize,transcript
/home/jia/project/backend/audios/test/1249120_41150153_11453544.wav,114732,i have a rash and it itches very bad 
/home/jia/project/backend/audios/test/1249120_38548574_89632552.wav,68312,i feel shoulder pain at intervals of time 
/home/jia/project/backend/audios/test/1249120_43453425_50442547.wav,196652,surgical wounds red  firing pus  painful and hot to the touch
/home/jia/project/backend/audios/test/1249120_40184183_17160527.wav,142040,when i stand up too quick my vision is blurry 
/home/jia/project/backend/audios/test/1249120_43172391_30380825.wav,240344,when i tried to answer the phine call i found that i can't hear the voice of the speaker
/home/jia/project/backend/audios/test/1249120_1853182_86923401.wav,115960,my face break out badly every month around my cycle 
/home/jia/project/backend/audios/test/1249120_29672643_29778280.wav,288344,you won't believe me  but this infected wound on my hand is from a paper cut i didn't take seriously 
/home/jia/project/backend/audios/test/1249120_41203338_18442475.wav,89210,i feel pain in my stomach
/home/jia/project/backend/audios/test/1249120_40184183_20238720.wav,81964,something dark is there on my arm
/home/jia/project/backend/audios/test/1249120_18985376_71664235.wav,117464,i can't get a girlfriend because of my acne 
/home/jia/project/backend/audios/test/1249120_43825820_27367589.wav,57388,i'm feeling nauseous
/home/jia/project/backend/audios/test/1249120_35408915_70587858.wav,136578,my back hurts so much i can't bend down to tie my shoelaces 
/home/jia/project/backend/audios/test/1249120_43316708_22877351.wav,103810,i have a hard pain in my stomach
/home/jia/project/backend/audios/test/1249120_43105396_55736762.wav,106540,my infected wound caused a fever
/home/jia/project/backend/audios/test/1249120_39740177_108467169.wav,147500,my back hurts me and i can't bend it or walk
/home/jia/project/backend/audios/test/1249120_18172663_58938998.wav,112002,my muscles in my lower back are aching 
/home/jia/project/backend/audios/test/1249120_15004831_107186195.wav,147500,i complain alot with my neck pain and i really need to be better
/home/jia/project/backend/audios/test/1249120_43856216_56065266.wav,131116,i have a rash and it itches very bad 
/home/jia/project/backend/audios/test/1249120_43105396_55385390.wav,103810,i lose a lot of my hair
/home/jia/project/backend/audios/test/1249120_33905644_101569645.wav,346840,i feel chilly  like an ice cube   my sister said that she needs several blankets to cover her so that she is warm enough 
/home/jia/project/backend/audios/test/1249120_41203338_43924603.wav,115960,i can't sleep i have a hard cough
/home/jia/project/backend/audios/test/1249120_43453425_10450489.wav,92888,stomach pain after drinking milk
/home/jia/project/backend/audios/test/1249120_15830408_49631021.wav,199384,i have a blurry vision and i can't see in the darkness   what is the reason doctor  
/home/jia/project/backend/audios/test/1249120_44142156_57732204.wav,183000,my sore isn't healing well and it's been like this for two weeks 
/home/jia/project/backend/audios/test/1249120_43788827_58376278.wav,193236,feels like there are pins and needles sticking in my joints
/home/jia/project/backend/audios/test/1249120_43855932_87921433.wav,92888,my foot is hurting so much 
/home/jia/project/backend/audios/test/1249120_41221824_59788826.wav,106540,when i get up i see my skin vague
/home/jia/project/backend/audios/test/1249120_43577102_97214624.wav,315094,my daughter was bit by her cat and now her hand is sore  red and swollen and the wound is oozing liquid 
/home/jia/project/backend/audios/test/1249120_40184183_107943557.wav,87426,i have severe shoulder pain
/home/jia/project/backend/audios/test/1249120_39154234_59204077.wav,191192,i think there's something wrong with my wound  it does not seem to heal like it should 
/home/jia/project/backend/audios/test/1249120_30766630_91159589.wav,130820,i can't do anything i feel a weak in my body
/home/jia/project/backend/audios/test/1249120_35444693_64114695.wav,133848,i can't walk  my knee hurts me
/home/jia/project/backend/audios/test/1249120_44027675_13938340.wav,71042,there is a constant tickle in my throat
/home/jia/project/backend/audios/test/1249120_20518958_102076059.wav,68404,i have an indigestion
/home/jia/project/backend/audios/test/1249120_27392644_64208392.wav,215768,i cut my hand a couple of weeks ago and even though i keep using an antibiotic cream it's not getting better 
/home/jia/project/backend/audios/test/1249120_29289135_48493379.wav,109272,i hate my acne 
/home/jia/project/backend/audios/test/1249120_44140394_87725441.wav,107042,when i play football i have muscle pain 
/home/jia/project/backend/audios/test/1249120_29289135_23432419.wav,150232,i feel dizzy after severe diarrhea
/home/jia/project/backend/audios/test/1249120_42210938_107178252.wav,128386,my body feels weak although i take my vitamins regularly 
/home/jia/project/backend/audios/test/1249120_43612961_73911583.wav,190262,my body feels weak after my first day in the gym  why 
/home/jia/project/backend/audios/test/1249120_40184183_29443999.wav,355032,i never had any acne problem until my last pregnancy  when all of a sudden my back got covered in zits 
/home/jia/project/backend/audios/test/1249120_43918153_57465443.wav,125656,i feel dizzy after doing a muscular effort 
/home/jia/project/backend/audios/test/1249120_15830408_46145042.wav,81964,i have a throbbing in my joints
/home/jia/project/backend/audios/test/1249120_35448024_87507425.wav,83266,i feel a pain in my back
/home/jia/project/backend/audios/test/1249120_2171654_63059993.wav,139736,when i stand up too quickly i start to feel dizzy and light headed
/home/jia/project/backend/audios/test/1249120_41841195_99383904.wav,76504,i feel a pain in my back
/home/jia/project/backend/audios/test/1249120_43604449_95204963.wav,213036,i feel deep tingling when i touch acne followed by bad sensation
/home/jia/project/backend/audios/test/1249120_35154350_51189453.wav,215768,when i brush my hair i notice big clumps of hair coming out in the brush 
/home/jia/project/backend/audios/test/1249120_41150153_80473769.wav,207576,every morning when i wake up my neck feels like i slept on in wrong 
/home/jia/project/backend/audios/test/1249120_43856216_82119397.wav,177538,my sore isn't healing well and it's been like this for two weeks 
/home/jia/project/backend/audios/test/1249120_42554554_86097615.wav,245804,i just can't seem to get warm   even when everyone around me is warm i always feel cold 
/home/jia/project/backend/audios/test/1249120_19425875_41547659.wav,120194,i have shoulder pain when i try to carry my groceries 
/home/jia/project/backend/audios/test/1249120_35197064_83703590.wav,92888,when i play football i have joint pain 
/home/jia/project/backend/audios/test/1249120_18172663_76088473.wav,101080,i have injured myself during the soccer match
/home/jia/project/backend/audios/test/1249120_43402738_106409407.wav,281304,i am struggling to bear weight on my knee  when i stand straight i feel and hear a loud popping noise 
/home/jia/project/backend/audios/test/1249120_44111844_77506804.wav,161154,even if the temperature is high in the house   my body is always cold
/home/jia/project/backend/audios/test/1249120_29713479_100417763.wav,205124,i've noticed my hair falling out a lot lately 
/home/jia/project/backend/audios/test/1249120_43995026_60816344.wav,183000,i can't hear out of my ear properly  i feel like there is something in it causing irritation 
/home/jia/project/backend/audios/test/1249120_43172391_107589076.wav,174808,i stopped sports because i get injury from sports
/home/jia/project/backend/audios/test/1249120_39740177_83040099.wav,139308,there are some pimples on my face that bother me a lot
/home/jia/project/backend/audios/test/1249120_38548574_42855973.wav,87426,i feel a tightness in my chest
/home/jia/project/backend/audios/test/1249120_42554554_99823922.wav,101080,my knee hurts when i play squash
/home/jia/project/backend/audios/test/1249120_43918153_72345932.wav,150232,it feels like i can't take a deep breath
/home/jia/project/backend/audios/test/1249120_43794413_36409293.wav,145680,my back hurts a lot when i bend
/home/jia/project/backend/audios/test/1249120_18386513_62259179.wav,139736,i complain alot with my neck pain and i really need to be better
/home/jia/project/backend/audios/test/1249120_43612961_52780930.wav,110014,when i remember her i feel down
/home/jia/project/backend/audios/test/1249120_22345789_46921961.wav,151624,itch at front and center of scalp
/home/jia/project/backend/audios/test/1249120_19425875_97135079.wav,117464,i have a hard muscle pain since i went to the gym
/home/jia/project/backend/audios/test/1249120_29713479_38088255.wav,89210,have severe cold and cough
/home/jia/project/backend/audios/test/1249120_35832653_69020380.wav,95618,i have an open wound in my arm
/home/jia/project/backend/audios/test/1249120_39740177_23857907.wav,106540,my shoulder hurts me so much
/home/jia/project/backend/audios/test/1249120_38202325_24078029.wav,90156,my ear hurts when i touch it 
/home/jia/project/backend/audios/test/1249120_43665783_101422665.wav,213036,i feel pain in my joint after an injury in the last football match i played 
/home/jia/project/backend/audios/test/1249120_43855932_83520700.wav,98348,i can't walk  my knee hurts me
/home/jia/project/backend/audios/test/1249120_42557795_23958540.wav,177538,my foot hurts and i can't turn it   maybe it's broken 
/home/jia/project/backend/audios/test/1249120_43995026_108448401.wav,79234,when i stand up too quick my vision is blurry 
/home/jia/project/backend/audios/test/1249120_40401830_65395442.wav,147500,when i stand up too quickly i start to feel dizzy and light headed
/home/jia/project/backend/audios/test/1249120_40419625_22223723.wav,127848,i have a ear ache when i go to the pool
/home/jia/project/backend/audios/test/1249120_29289135_109412394.wav,125656,i feel pain in my knee when i climb the stairs 
/home/jia/project/backend/audios/test/1249120_39438102_62989114.wav,109272,i have a pain in my trapes
/home/jia/project/backend/audios/test/1249120_14353703_99001242.wav,125656,when i raise my hand i feel pain in my shoulder 
/home/jia/project/backend/audios/test/1249120_40184183_55912959.wav,256728,feels like there are pins and needles sticking in my joints
/home/jia/project/backend/audios/test/1249120_30937687_50836807.wav,115960,my shoulder is hurting me
/home/jia/project/backend/audios/test/1249120_38202325_33582422.wav,95618,i have issue with my skin
/home/jia/project/backend/audios/test/1249120_17632529_104451359.wav,136764,i am feeling so dizzy  body is so fragile 
/home/jia/project/backend/audios/test/1249120_36505751_80281628.wav,152962,standing less than five minutes and my back start to ache
/home/jia/project/backend/audios/test/1249120_44101988_84873792.wav,180268,i feel deep tingling when i touch acne followed by bad sensation
/home/jia/project/backend/audios/test/1249120_42554554_20827076.wav,131116,i have pain like needles in my joints 
/home/jia/project/backend/audios/test/1249120_38202325_90838355.wav,81964,i wake up at night feeling cold
/home/jia/project/backend/audios/test/1249120_43350908_30335716.wav,103810,there is a sharp pain in my ear whenever i do this 
/home/jia/project/backend/audios/test/1249120_43825820_106367676.wav,121560,hearing any loud sounds makes my ear aches
/home/jia/project/backend/audios/test/1249120_43758322_46112413.wav,120194,my head hurts when i'm doing this 
/home/jia/project/backend/audios/test/1249120_15004831_85662551.wav,103810,i feel pain in my neck
/home/jia/project/backend/audios/test/1249120_44101988_90061069.wav,207576,it started as a tinnitus  but today the pain is throbbing and unbearable 
/home/jia/project/backend/audios/test/1249120_1853182_97701404.wav,83266,his infected wound was beginning to rot 
/home/jia/project/backend/audios/test/1249120_43856216_31896487.wav,128386,i have pain in my chest that saddens me 
/home/jia/project/backend/audios/test/1249120_43788827_79200909.wav,139736,i have a problem in my back i cannot extend it
/home/jia/project/backend/audios/test/1249120_40401830_16848665.wav,84696,i have a pain in my elbow joint
/home/jia/project/backend/audios/test/1249120_18386513_43428617.wav,110014,i have an internal pain i cannot describe
/home/jia/project/backend/audios/test/1249120_42210938_109594891.wav,125656,laceration  rupture or opening in the skin
/home/jia/project/backend/audios/test/1249120_38042052_46381914.wav,139308,i feel a sharp pain in my stomach
/home/jia/project/backend/audios/test/1249120_43883861_104123530.wav,122924,my ear ache when i'm listening to music 
/home/jia/project/backend/audios/test/1249120_43453425_100609046.wav,60120,i have pain in my stomach
/home/jia/project/backend/audios/test/1249120_43316708_35817306.wav,169346,i feel like something is squeezing my lungs 
/home/jia/project/backend/audios/test/1249120_43350908_32430898.wav,142040,standing less than five minutes and my back start to ache
/home/jia/project/backend/audios/test/1249120_2171654_15700530.wav,83266,yesterday i had a shouder pain
/home/jia/project/backend/audios/test/1249120_15004831_56564278.wav,133848,it feels like i can't take a deep breath
/home/jia/project/backend/audios/test/1249120_44111844_59865705.wav,185730,i hit my head at the basketball game   could i have a concussion 
/home/jia/project/backend/audios/test/1249120_18386513_92126820.wav,202152,i got a divorce last year and i just can't stop dwelling on how to get revenge on my ex husband 
/home/jia/project/backend/audios/test/1249120_43612961_58304053.wav,205124,i think there's something wrong with my wound  it does not seem to heal like it should 
/home/jia/project/backend/audios/test/1249120_43172391_56971651.wav,223960,i have whooping cough with excess mucous  need mucolytic 
/home/jia/project/backend/audios/test/1249120_43402738_90238585.wav,177538,my knees seem to grind as i go up or down stairs 
/home/jia/project/backend/audios/test/1249120_41956733_56615257.wav,193922,i cut myself and i'm bleeding 
/home/jia/project/backend/audios/test/1249120_43995026_48220450.wav,87426,i get an ear ache when it is cold
/home/jia/project/backend/audios/test/1249120_39740177_48180640.wav,196652,my husband has a spot on his lip that he though was cold sore but now it has broken open and leaks fluid all day 
/home/jia/project/backend/audios/test/1249120_43453425_53595655.wav,147500,my body feels weak after my first day in the gym  why 
/home/jia/project/backend/audios/test/1249120_35154350_21491579.wav,161154,the acne was causing me to feel embarrassed 
/home/jia/project/backend/audios/test/1249120_43951421_55719816.wav,155692,i feel pain in my neck after waking up
/home/jia/project/backend/audios/test/1249120_18985376_52521065.wav,128386,i have a cut that has become red and oozes puss 
/home/jia/project/backend/audios/test/1249120_29289135_42853161.wav,139308,i have a back pain since i fell on the floor 
/home/jia/project/backend/audios/test/1249120_42557795_37473436.wav,117464,i have a powerful pain inside my neck
/home/jia/project/backend/audios/test/1249120_43883861_80169050.wav,243074,i had a cold the last time i travelled by plane and i still have a discomfort in my ears 
/home/jia/project/backend/audios/test/1249120_43719934_36107167.wav,136578,i love to walk and be outside but the bottoms of my feet get sore so quickly 
/home/jia/project/backend/audios/test/1249120_1853182_12060422.wav,112986,oh my heart hurts me i tried to be calm and i can't
/home/jia/project/backend/audios/test/1249120_43951421_64057539.wav,114732,i can't get a girlfriend because of my acne 
/home/jia/project/backend/audios/test/1249120_44101988_23039167.wav,300418,my daughter was bit by her cat and now her hand is sore  red and swollen and the wound is oozing liquid 
/home/jia/project/backend/audios/test/1249120_15004831_56405823.wav,84696,there pain in my foot
/home/jia/project/backend/audios/test/1249120_44088493_13285750.wav,112002,it's hard to stand up  and i'm moving very slowly
/home/jia/project/backend/audios/test/1249120_43316708_87750238.wav,114732,my heart hurts while i'm sad  why 
/home/jia/project/backend/audios/test/1249120_43883861_39922447.wav,185730,i have a feeling like my whole body is complaining
/home/jia/project/backend/audios/test/1249120_44101988_96931564.wav,158424,i have a skin rash after eating an ice cream 
/home/jia/project/backend/audios/test/1249120_41087148_100376153.wav,183000,i'm not hearing well i have problem with my ear
/home/jia/project/backend/audios/test/1249120_36929821_13462031.wav,193922,my grandmother last year went to hospital because she was having a hard time breathing
/home/jia/project/backend/audios/test/1249120_21665495_42276484.wav,169346,my body feels weak and i think that my face is fade and i can't sleep well
/home/jia/project/backend/audios/test/1249120_6338946_43939076.wav,81964,my shoulder hurts me so much
/home/jia/project/backend/audios/test/1249120_44101988_103474667.wav,172076,all my body is in a bad case and i need a good treatment
/home/jia/project/backend/audios/test/1249120_35448024_108551418.wav,148652,my child has cough all night  she can't sleep
/home/jia/project/backend/audios/test/1249120_6338946_40270934.wav,95618,i have pimples on my back 
/home/jia/project/backend/audios/test/1249120_40401830_60227108.wav,128386,the warming system of my house is broken and  feel so cold
/home/jia/project/backend/audios/test/1249120_18172663_26044172.wav,84696,i feel like my heart is on fire 
/home/jia/project/backend/audios/test/1249120_29289135_23611758.wav,215768,i have a problem in the expiration because i have abronchial asthma
/home/jia/project/backend/audios/test/1249120_43719934_58797768.wav,125656,redness  swelling  and difficulty walking
/home/jia/project/backend/audios/test/1249120_39740177_40686320.wav,144770,i can't stand with this horrible feeling in my stomach
/home/jia/project/backend/audios/test/1249120_41221824_10914923.wav,191192,my hair is falling without a reason  i can see a lot of hair on my working desk 
/home/jia/project/backend/audios/test/1249120_43604449_87748884.wav,90156,my head is spinning when i get up 
/home/jia/project/backend/audios/test/1249120_13842059_94785546.wav,120194,there are some pimples on my face that bother me a lot
/home/jia/project/backend/audios/test/1249120_15965551_44782675.wav,131800,i have eruptions on my face that come and go  
/home/jia/project/backend/audios/test/1249120_39438102_66400622.wav,161154,my chest break out with red pimples and whiteheads 
/home/jia/project/backend/audios/test/1249120_43577102_20965165.wav,101098,i've been feeling very sad lately
/home/jia/project/backend/audios/test/1249120_42554554_59428675.wav,103810,i had a pain in my knee when i was swimming
/home/jia/project/backend/audios/test/1249120_38042052_97599935.wav,139308,i feel joint pain every time i move
/home/jia/project/backend/audios/test/1249120_43453425_105310162.wav,207576,i cut my finger opening a can  it won't stop bleeding and the wound is gaping and open
/home/jia/project/backend/audios/test/1249120_43951421_52837630.wav,98348,my upper back has been sore for a week 
/home/jia/project/backend/audios/test/1249120_22423108_14839544.wav,136578,i have a back pain since i fell on the floor 
/home/jia/project/backend/audios/test/1249120_43105396_93760266.wav,112002,my acne gets worse when it is hot
/home/jia/project/backend/audios/test/1249120_43788827_71697309.wav,199180,i feel pain in my joint after an injury in the last football match i played 
/home/jia/project/backend/audios/test/1249120_28006404_35048167.wav,92182,i have a headache every time i eat ice cream
/home/jia/project/backend/audios/test/1249120_43918153_81804760.wav,117464,i feel pain in my foot
/home/jia/project/backend/audios/test/1249120_43825820_24821264.wav,200748,i have a sharp pain and clicking sound in my ankle joint when i try to stand on it and walk 
/home/jia/project/backend/audios/test/1249120_18386513_57790418.wav,115960,i can't get a girlfriend because of my acne 
/home/jia/project/backend/audios/test/1249120_41956733_97772949.wav,273112,after playing tennis   i had a powerful sensation close to my neck
/home/jia/project/backend/audios/test/1249120_43105396_104916619.wav,114732,i have a foot ache in winter  or when it feels cold  why 
/home/jia/project/backend/audios/test/1249120_39438102_48349084.wav,133848,i feel like the room is spinning
/home/jia/project/backend/audios/test/1249120_40663048_61049341.wav,131116,why is my shoulder aching when i try to pick up the laundry 
/home/jia/project/backend/audios/test/1249120_44140394_76323770.wav,118932,i can't stand with this horrible feeling in my stomach
/home/jia/project/backend/audios/test/1249120_36505751_63071014.wav,193922,when i'm awake in the morning i feel strange and have vertigo
/home/jia/project/backend/audios/test/1249120_44091626_15292165.wav,133848,all of a sudden i felt dizzy when i stood up 
/home/jia/project/backend/audios/test/1249120_2171654_72266245.wav,98126,i feel a soreness in my knees when i walk
/home/jia/project/backend/audios/test/1249120_1853182_21950254.wav,145680,i have a foot ache in winter  or when it feels cold  why 
/home/jia/project/backend/audios/test/1249120_41841195_88739886.wav,188460,you won't believe me  but this infected wound on my hand is from a paper cut i didn't take seriously 
/home/jia/project/backend/audios/test/1249120_43577102_103503053.wav,145680,my foot hurts and i can't turn it   maybe it's broken 
/home/jia/project/backend/audios/test/1249120_44093303_93746287.wav,133792,my kneecap feels like it is grating bone on bone when i walk 
/home/jia/project/backend/audios/test/1249120_34824899_32864383.wav,151624,i complain alot with my neck pain and i really need to be better
/home/jia/project/backend/audios/test/1249120_27392644_27648433.wav,150914,surgical wounds red  firing pus  painful and hot to the touch
/home/jia/project/backend/audios/test/1249120_30766630_100912461.wav,202152,longitudinal burning line across back with hard respiratory movements
/home/jia/project/backend/audios/test/1249120_36214391_57369240.wav,196652,i suffered a deep wound in my hand and i can not stop the bleeding
/home/jia/project/backend/audios/test/1249120_22345789_55660448.wav,136764,my entire body is freezing 
/home/jia/project/backend/audios/test/1249120_18172663_11717053.wav,125656,my abdominal muscles have great pain since i was at gym
/home/jia/project/backend/audios/test/1249120_40017708_39318025.wav,104070,my joints ache whenever it is cold
/home/jia/project/backend/audios/test/1249120_22345789_18698172.wav,196208,i feel something hurt me in taking breath and i cant take my breath
/home/jia/project/backend/audios/test/1249120_15004831_10233205.wav,169346,when i move my shoulder  it's like lightning is being sent through my shoulder
/home/jia/project/backend/audios/test/1249120_33251186_55229324.wav,150232,i have a back pain since i fell on the floor 
/home/jia/project/backend/audios/test/1249120_38548574_82754775.wav,278572,i hve cut my finger because of playing football and i  to apply pain relief cream but it does not help
/home/jia/project/backend/audios/test/1249120_29672643_12871727.wav,214040,my foot had been aching since last tuesday 
/home/jia/project/backend/audios/test/1249120_22345789_81720117.wav,362648,i started taking swimming lessons and i guess i swallowed too much water through my nose  because this sinusitis is killing me now 
/home/jia/project/backend/audios/test/1249120_42210938_46153649.wav,87426,cramps along the whole abdomen
/home/jia/project/backend/audios/test/1249120_41087148_48929664.wav,122924,my body feels like it's in a refrigerator 
/home/jia/project/backend/audios/test/1249120_41087148_84065638.wav,150232,my body feels weak although i take my vitamins regularly 
/home/jia/project/backend/audios/test/1249120_40725179_84485488.wav,136764,i was playing football and injuried with joint pain 
/home/jia/project/backend/audios/test/1249120_29289135_60618905.wav,183000,i feel a huge emotional pain after i broke up with my girlfriend 
/home/jia/project/backend/audios/test/1249120_35444693_19709454.wav,81964,i feel sad
/home/jia/project/backend/audios/test/1249120_44111844_29830362.wav,131116,my shoulder hurts when i try to reach something above my head 
/home/jia/project/backend/audios/test/1249120_43612961_94242062.wav,107042,when i play football i have joint pain 
/home/jia/project/backend/audios/test/1249120_43951421_32599964.wav,90156,i cant breathe
/home/jia/project/backend/audios/test/1249120_6338946_99780649.wav,95618,i wake up at night feeling cold
/home/jia/project/backend/audios/test/1249120_19425875_46584012.wav,112002,i have eruptions on my face that come and go  
/home/jia/project/backend/audios/test/1249120_41203338_47469498.wav,175402,i feel hurt  lot of pain in my heart
/home/jia/project/backend/audios/test/1249120_27392644_32901200.wav,144088,my hair is coming out in chunks  especially when i wash it
/home/jia/project/backend/audios/test/1249120_35408915_90303179.wav,98348,my foot hurts me a lot of playing football
/home/jia/project/backend/audios/test/1249120_43612961_101397712.wav,101098,i can t stop coughing 
/home/jia/project/backend/audios/test/1249120_43898158_11366758.wav,84696,i feel a pain in my back
/home/jia/project/backend/audios/test/1249120_40419625_37685293.wav,347788,my daughter had her eyebrows threaded and it pulled an opening of skin in one of her brows that is now puffy and oozing 
/home/jia/project/backend/audios/test/1249120_17632529_99387256.wav,166486,i tried alot of cream but i still feel the same skin problem
/home/jia/project/backend/audios/test/1249120_43995026_35631539.wav,81964,i can't breath because of  cough
/home/jia/project/backend/audios/test/1249120_43758322_35726308.wav,185730,i tried alot of cream but i still feel the same skin problem
